{
  "version": 1,
  "run_id": "20260805-guided-brand-model-flow",
  "sealed_at": "2026-08-05T17:16:41.882738+00:00",
  "task_hash": "sha256:2cc29ba1ba81953f038c6686f5c347e036cd10bc0db3254f6dfc559cde4caa83",
  "evidence_hash": "sha256:3cbe9577669da7da5360a2c3f63bce70323cc0747957e60aa45b21406680a83d",
  "files": {
    ".design-harness/config.json": "sha256:04072df9107eee519a90bbfd4b2e242e773a13cb6841e47e0d207cd2679128f5",
    ".design-harness/runs/20260805-guided-brand-model-flow/SPEC.md": "sha256:feb6d95f2ba42224d42fcf2f3b575fa56ce01bb43d29b941598e8c2918faf409",
    ".design-harness/runs/20260805-guided-brand-model-flow/brief.md": "sha256:55df208bed1fa54a498db6058eb6b77cdce88f7fca4025aab8ddf7f07c580980",
    ".design-harness/runs/20260805-guided-brand-model-flow/build.log": "sha256:5094ff952ad972036a05f64ceeb20e7804a6be2c8589e9906ace9873ecad9569",
    ".design-harness/runs/20260805-guided-brand-model-flow/component-map.md": "sha256:7c55b686dbcc6c4caea0aee26b9ba744d15c31fba448bf57151f44d2a59c5c0f",
    ".design-harness/runs/20260805-guided-brand-model-flow/design-drift.log": "sha256:2b29ad63984615a9e0f9b030f9b4d50c0e27fb45986a1cdfb63cd9fe43abf65b",
    ".design-harness/runs/20260805-guided-brand-model-flow/discovery.md": "sha256:868f1ba66143abe2881ae9d683f453bfdaddb4e1e5e3aaca37210fa11c489948",
    ".design-harness/runs/20260805-guided-brand-model-flow/evidence/drift-report.json": "sha256:f98556090965269c85c38bbe7266ec6d6bfe73f9a3a480f90c4c77ba4086d115",
    ".design-harness/runs/20260805-guided-brand-model-flow/evidence.json": "sha256:3cbe9577669da7da5360a2c3f63bce70323cc0747957e60aa45b21406680a83d",
    ".design-harness/runs/20260805-guided-brand-model-flow/guided-flow-tests.log": "sha256:29aa166da1a09ba9ef703827e87420eab7454d193ab12713052b7feb33d2a018",
    ".design-harness/runs/20260805-guided-brand-model-flow/review.md": "sha256:ae089b4f46e86c9c015fdb378f1422c74b3f683a54e9fe3f583b6637679fe55a",
    ".design-harness/runs/20260805-guided-brand-model-flow/screenshots/default-320.png": "sha256:13593da7385fec771da49526384a97e31051d41eb03ad98d0293680776e3dfcd",
    ".design-harness/runs/20260805-guided-brand-model-flow/screenshots/disabled-1440.png": "sha256:b4fb6f4f5ea00325ea3d3c4ee0c893e4eca87fee45cbfee6f4e58cc667fc71c8",
    ".design-harness/runs/20260805-guided-brand-model-flow/screenshots/empty-320.png": "sha256:384e8450de45634514192ce1f8f83730b33782450aef1e431972bab2ffa9c06f",
    ".design-harness/runs/20260805-guided-brand-model-flow/screenshots/error-768.png": "sha256:085ba68bcfa46402871c6be147fdfe13aa22fd7b23246d6cfd23345d0e9fc06d",
    ".design-harness/runs/20260805-guided-brand-model-flow/screenshots/focus-768.png": "sha256:0aa5a547de7da5df8621208a20e33506c6f2cbf7fee128e9b2ceba7d4865de58",
    ".design-harness/runs/20260805-guided-brand-model-flow/screenshots/loading-1440.png": "sha256:842732186401b9016a68d8d7df84267e69985e63004a9ecd70332b158c7c7700",
    ".design-harness/runs/20260805-guided-brand-model-flow/screenshots/reflow-200-320.png": "sha256:ab4c30a733af4d8c268c9d775ba0a839afbdf2148751af1f378827ecf5361fe1",
    ".design-harness/runs/20260805-guided-brand-model-flow/screenshots/success-1440.png": "sha256:4f94e8fa905e80e645b3426e7f710cba9ef201221091328a496e73e839127772",
    ".design-harness/runs/20260805-guided-brand-model-flow/task.json": "sha256:2cc29ba1ba81953f038c6686f5c347e036cd10bc0db3254f6dfc559cde4caa83",
    ".design-harness/runs/20260805-guided-brand-model-flow/visual-direction.md": "sha256:785135559981a7248b7dbcf49140f59b0979bdb11c3536058f27a0278a5cd102"
  },
  "packet_hash": "sha256:57b8eec636564626657df4f160934ff1ab5b4d66bd6c5ad3a0b2d30691314115"
}
