{
  "version": 1,
  "run_id": "20260801-cohort-6-audio-energy",
  "sealed_at": "2026-08-01T18:14:33.423346+00:00",
  "task_hash": "sha256:d4d07b62c013f5f870b835642c152daa3c0fb04c47671499b107f2d679b3189d",
  "evidence_hash": "sha256:94af1fd117f767bede0a60ddca5168d237a28fe8a7fa64b4cbe0ad852bd7eae2",
  "files": {
    ".design-harness/config.json": "sha256:04072df9107eee519a90bbfd4b2e242e773a13cb6841e47e0d207cd2679128f5",
    ".design-harness/runs/20260801-cohort-6-audio-energy/SPEC.md": "sha256:14e69230a3a88b9b665cf3884491a8edf892e2208feab8e189b33f33bc08c1cf",
    ".design-harness/runs/20260801-cohort-6-audio-energy/brief.md": "sha256:ba641291769e79cc55f0cb41c43d8cb5769555037a34fdbc4dc1cb0f5fdf8d63",
    ".design-harness/runs/20260801-cohort-6-audio-energy/component-map.md": "sha256:856afe6ef25ef7041a455b62e44a12f3595c9eabc3bcecf852a9af2a43713db7",
    ".design-harness/runs/20260801-cohort-6-audio-energy/discovery.md": "sha256:8d0fd7588a88c190bf6ddbcab8d3e7b534764aa9a0f1e7d6bd0e091591a4ee7e",
    ".design-harness/runs/20260801-cohort-6-audio-energy/evidence/drift-report.json": "sha256:54a9442d8972b7a1fbe645cf1178ecbe3d3315fa6e33a0b769528d1850f42f2b",
    ".design-harness/runs/20260801-cohort-6-audio-energy/evidence.json": "sha256:94af1fd117f767bede0a60ddca5168d237a28fe8a7fa64b4cbe0ad852bd7eae2",
    ".design-harness/runs/20260801-cohort-6-audio-energy/review.md": "sha256:482766d9ce7601b171f317c8b2d05ef29c5101e8d34e4a431d30cb3c688a3665",
    ".design-harness/runs/20260801-cohort-6-audio-energy/screenshots/energy-default-mobile.png": "sha256:3c528e8cca85314517c1d4612937598d62690caf8fb4010ad77ba2e6d1d3a581",
    ".design-harness/runs/20260801-cohort-6-audio-energy/screenshots/energy-disabled-mobile.png": "sha256:211217c11ab6f55146e6f617405b3d00f66620d0f3d09a44f8f053cb4f9a5bac",
    ".design-harness/runs/20260801-cohort-6-audio-energy/screenshots/energy-empty-mobile.png": "sha256:cce29f93e34aad90054743ae188baa0fdf43a03edeba6815b143c3067fa0611c",
    ".design-harness/runs/20260801-cohort-6-audio-energy/screenshots/energy-error-tablet.png": "sha256:31d92de758304139ec1c78d29055a9fdb0dcc28d35a5d4ac64c06264e3b65876",
    ".design-harness/runs/20260801-cohort-6-audio-energy/screenshots/energy-focus-tablet.png": "sha256:5288485b792ac5d1bc21c40c74d9b854bc371406c66f538617c986667b93b5c4",
    ".design-harness/runs/20260801-cohort-6-audio-energy/screenshots/energy-loading-desktop.png": "sha256:58f8c2507ee8f307d58c963a929b4f8a398a2fcfb2784d8bb95a9ecb00e42172",
    ".design-harness/runs/20260801-cohort-6-audio-energy/screenshots/energy-success-mobile-zoom200.png": "sha256:86928c7d24b2afa2955abf95ff1b269e9b72b9342fbe85174adafc9aeaf37447",
    ".design-harness/runs/20260801-cohort-6-audio-energy/screenshots/energy-success-mobile.png": "sha256:a1887662c8c88b6d0dd4873b4083bea58c95ccbf26ae15b709d9b61bdb4c686b",
    ".design-harness/runs/20260801-cohort-6-audio-energy/screenshots/headphones-default-tablet.png": "sha256:6b8e4f537e714b776f81f1e70ae9134f94a6b9c7c66bfa30f648525237e9e9be",
    ".design-harness/runs/20260801-cohort-6-audio-energy/screenshots/headphones-external-path-tablet.png": "sha256:f6937dff4682f23207c001eb420deb3ff98f1cdeb66b512bf5a0b403e7d0a1e8",
    ".design-harness/runs/20260801-cohort-6-audio-energy/screenshots/headphones-success-tablet-text-spacing.png": "sha256:bd1d0d111f6c20e894a4d28c9a087b65fb4f43b1e425578635804298c5276e6c",
    ".design-harness/runs/20260801-cohort-6-audio-energy/screenshots/headphones-success-tablet.png": "sha256:a73da0e4439a6a59dcd1fc7b4b876dd13f74c9621d7abd908a1a2af93915f9b2",
    ".design-harness/runs/20260801-cohort-6-audio-energy/screenshots/speakers-default-mobile.png": "sha256:74a7d7a6a01d3a4b19c29b5b5ecad03b4e120bafdbbd2e711a1aa6b4a167df19",
    ".design-harness/runs/20260801-cohort-6-audio-energy/screenshots/speakers-disabled-mobile.png": "sha256:c5370c823d9797f34d2ce78365e338504fdd4c87cbdb6c0966f59278adb1454e",
    ".design-harness/runs/20260801-cohort-6-audio-energy/screenshots/speakers-error-mobile.png": "sha256:2f9a03704cd5dab4b077ea1af0b493fb8a37ace39224bdedcc382a4e5ad83214",
    ".design-harness/runs/20260801-cohort-6-audio-energy/screenshots/speakers-focus-mobile.png": "sha256:661c3ac0212586aef1b0d868740d2005ce9013bb9b3c0248e6d117b0965a3c6c",
    ".design-harness/runs/20260801-cohort-6-audio-energy/screenshots/speakers-loading-tablet.png": "sha256:d446290d21d5129dbbb3bacd97639e5b7b0b5b685e63934f006ce24b5fcfdbdc",
    ".design-harness/runs/20260801-cohort-6-audio-energy/screenshots/speakers-needs-check-mobile.png": "sha256:dec1e33b1c00bb9345ba38174b5ff6ea552529448c01f9f5259b18f2ee8127bb",
    ".design-harness/runs/20260801-cohort-6-audio-energy/screenshots/speakers-retry-desktop.png": "sha256:7384148f24444cb775a2cbb1a142683e009804174108c074b2697ee6b5d51a47",
    ".design-harness/runs/20260801-cohort-6-audio-energy/screenshots/speakers-service-boundary-desktop.png": "sha256:42d81d39b61fac9f3da4fe21b2fde564f865fd092f2278a0afcd7be28ec88b4a",
    ".design-harness/runs/20260801-cohort-6-audio-energy/screenshots/speakers-success-desktop.png": "sha256:34d5dbdf2f1e01ab12a993543f811508f82ef344339eb7a9efbf5fb8ffa9a6d7",
    ".design-harness/runs/20260801-cohort-6-audio-energy/task.json": "sha256:d4d07b62c013f5f870b835642c152daa3c0fb04c47671499b107f2d679b3189d",
    ".design-harness/runs/20260801-cohort-6-audio-energy/visual-direction.md": "sha256:55b41057cea4d04b5f898166ce3fb8e2fc4accb9ffe41c6b9c33e5c7a5e3137c"
  },
  "packet_hash": "sha256:8b0de079c4afacaa08fe6aac65d4fac627064d4e111810de02b375d5eea6f2ec"
}
