{
  "version": 1,
  "run_id": "20260801-cohort-7-smart-tv",
  "sealed_at": "2026-08-01T19:11:09.333138+00:00",
  "task_hash": "sha256:754febd252adeec60f0a14ed8d03d11e02f6cbb8f9e4383e0342ef8a2ece9e3f",
  "evidence_hash": "sha256:ac7febb56674cfe49247c9ed2a356c6b3a6b532fd312f5a4ff16efef5a6f0fdd",
  "files": {
    ".design-harness/config.json": "sha256:04072df9107eee519a90bbfd4b2e242e773a13cb6841e47e0d207cd2679128f5",
    ".design-harness/runs/20260801-cohort-7-smart-tv/SPEC.md": "sha256:6460f0b1e0b487fa721df409dcc541889ce3e96e6a47ea527e96bd733a4531c0",
    ".design-harness/runs/20260801-cohort-7-smart-tv/brief.md": "sha256:c6783b24739cc4a065adf2e03a69ba6a68e356ad9ebb7d25adabbd916ccb822c",
    ".design-harness/runs/20260801-cohort-7-smart-tv/component-map.md": "sha256:f1eb3b0fd2b146c80dcaf80f71de2b74e041d2987ea2450504139f09bf72dba5",
    ".design-harness/runs/20260801-cohort-7-smart-tv/discovery.md": "sha256:30fd7ce3ce649b8fb35a25803427bc849a4963f7113d10016c4ba679f2aab919",
    ".design-harness/runs/20260801-cohort-7-smart-tv/evidence.json": "sha256:ac7febb56674cfe49247c9ed2a356c6b3a6b532fd312f5a4ff16efef5a6f0fdd",
    ".design-harness/runs/20260801-cohort-7-smart-tv/review.md": "sha256:05f7788d8fad0a5e17b9bf02cdc115833c967c4f9d583d86f9845da41c5df8f2",
    ".design-harness/runs/20260801-cohort-7-smart-tv/screenshots/apps-desktop-external-path.png": "sha256:29968e59ad0a09b74609a76631c48ac64e40213382c83ab87cf38b7286697caf",
    ".design-harness/runs/20260801-cohort-7-smart-tv/screenshots/apps-mobile-disabled.png": "sha256:2507f115847e653cff22892b269b3222f8ccb523729861b6946dc90bccfd57e3",
    ".design-harness/runs/20260801-cohort-7-smart-tv/screenshots/apps-mobile-success.png": "sha256:4f3e701a2714344ceba50a0467b04e57a646bc208f54108b801e0aa1f3c8e700",
    ".design-harness/runs/20260801-cohort-7-smart-tv/screenshots/apps-tablet-default.png": "sha256:720a317c3ae91245dc268029fb0b004d502c1b7f30637259fcb70aaee96178f2",
    ".design-harness/runs/20260801-cohort-7-smart-tv/screenshots/apps-tablet-error.png": "sha256:d671c47cf4e48028a0f36da8c16842413663c348326146eaa3faf0932ce7507c",
    ".design-harness/runs/20260801-cohort-7-smart-tv/screenshots/firmware-desktop-loading.png": "sha256:52eed6b97475ab4fe7fcca21fa170ced7045e2c990cb8b741da16819cc280e3e",
    ".design-harness/runs/20260801-cohort-7-smart-tv/screenshots/firmware-desktop-success.png": "sha256:0b2dbf484457527864755b0c1f55ae05b04975e801ac03c27dd2043dd3f2369a",
    ".design-harness/runs/20260801-cohort-7-smart-tv/screenshots/firmware-mobile-default.png": "sha256:3a41de2bc8f79248e92ff471716c6fa591092d3e55c416fa51249e521c550eb9",
    ".design-harness/runs/20260801-cohort-7-smart-tv/screenshots/firmware-mobile-empty.png": "sha256:cbcc07e0a2b77722401024c6d811d0c070a35fccf00abf4e1791c2f80008fac4",
    ".design-harness/runs/20260801-cohort-7-smart-tv/screenshots/firmware-tablet-text-spacing.png": "sha256:61291089293cc225823bcbe1b5465658b2ba023fd3d254e330c8c8543d4689b1",
    ".design-harness/runs/20260801-cohort-7-smart-tv/screenshots/reset-desktop-default.png": "sha256:0cdfb5aa649dafbc598ec0c41332e4c0de255f5737d975744bfe95f8cb64003a",
    ".design-harness/runs/20260801-cohort-7-smart-tv/screenshots/reset-mobile-200pct.png": "sha256:3a86b3eadd68b8f4c2a17dd825f4d45e1102dd3e852e905a626538651e5d4af7",
    ".design-harness/runs/20260801-cohort-7-smart-tv/screenshots/reset-mobile-needs-check.png": "sha256:a7ae13882eef97c2b43042180a0f1cb533426ec66ff49514257ca8e4432641ad",
    ".design-harness/runs/20260801-cohort-7-smart-tv/screenshots/reset-tablet-focus.png": "sha256:a6fad311f89d959790b51908d53ccebf6563c5aff15722ae57e8a1b9a66dd590",
    ".design-harness/runs/20260801-cohort-7-smart-tv/screenshots/reset-tablet-service-boundary.png": "sha256:13076fdb1a4b1b4eb10f5660f9633c437e0836e712d73e2bb3a0d7600f007a29",
    ".design-harness/runs/20260801-cohort-7-smart-tv/task.json": "sha256:754febd252adeec60f0a14ed8d03d11e02f6cbb8f9e4383e0342ef8a2ece9e3f",
    ".design-harness/runs/20260801-cohort-7-smart-tv/visual-direction.md": "sha256:01c36c698271f0057d6ee330fdee0b26a717896bfa3f049d9c5293e7f052504a"
  },
  "packet_hash": "sha256:55a4d58c6ded30edc97ed81e659e32a63d7e3ccfb10a8a7972cb73ebd80c742a"
}
