{
  "version": 1,
  "run_id": "20260801-tv-traffic-cohort-2",
  "sealed_at": "2026-08-01T13:34:32.766284+00:00",
  "task_hash": "sha256:3faf28bfd5907cf059887040f46545302506f9db2248443a96af76047a810a17",
  "evidence_hash": "sha256:b38dbe3cd6c00eb8492263d60b9a099b341b9df925dfc4e42b12d398296439bd",
  "files": {
    ".design-harness/config.json": "sha256:04072df9107eee519a90bbfd4b2e242e773a13cb6841e47e0d207cd2679128f5",
    ".design-harness/runs/20260801-tv-traffic-cohort-2/SPEC.md": "sha256:18fe0b410934d3555a953a4f0c696ef1a64ba8f7128acda3878bc5300c074741",
    ".design-harness/runs/20260801-tv-traffic-cohort-2/brief.md": "sha256:5676d909688719a7fa74bfd0e30886fef4f2cd63b7f2e2ce23297ea96fb178e9",
    ".design-harness/runs/20260801-tv-traffic-cohort-2/component-map.md": "sha256:f85408e0396ed1e6a5d1801d7e74997977559dd9f05934fe0aa5b4a73d40d526",
    ".design-harness/runs/20260801-tv-traffic-cohort-2/discovery.md": "sha256:178b0e98fa645e1824717884bff6da162fb3872cbad5a4659a809d14d86e5e27",
    ".design-harness/runs/20260801-tv-traffic-cohort-2/evidence/commands/cargo-fmt.log": "sha256:e3b0c44298fc1c149afbf4c8996fb92427ae41e4649b934ca495991b7852b855",
    ".design-harness/runs/20260801-tv-traffic-cohort-2/evidence/commands/npm-build.log": "sha256:6636923e08c05391b0aaf42cdcd464d9c6d6d04832ab679df4a58b887cc39fe9",
    ".design-harness/runs/20260801-tv-traffic-cohort-2/evidence/commands/npm-verify.log": "sha256:d3853a95d1a6ae540c4b2645f23de5cfaa26fe1a52ff4014370dc96a21a21e9f",
    ".design-harness/runs/20260801-tv-traffic-cohort-2/evidence/commands/release-audits.log": "sha256:e2ef05cac9be0ffd543623de450eb61d8a50e72c98a78531003f059eb4b016ba",
    ".design-harness/runs/20260801-tv-traffic-cohort-2/evidence/commands/rust-cohort.log": "sha256:78eafd09ccb53f0a218aab800f5e779ffeae45160ecc38a3eafa170ac9f27dd9",
    ".design-harness/runs/20260801-tv-traffic-cohort-2/evidence/commands/web-cohort.log": "sha256:c2e1e7297bc279d9300765730425aa5d08f12ef96254a3ace8d4caa8a4350087",
    ".design-harness/runs/20260801-tv-traffic-cohort-2/evidence/drift-report.json": "sha256:d7827412ca39dc4e1380e0b90f0de2a9b7e3e328cf59c7f70ea2bcb6c0e23ac3",
    ".design-harness/runs/20260801-tv-traffic-cohort-2/evidence/screenshots/digital-tablet-default.png": "sha256:aad2c4d8f314dca074f5b1b4114dd200b49ec2ae2e6097a868c2d67fcd3666b3",
    ".design-harness/runs/20260801-tv-traffic-cohort-2/evidence/screenshots/digital-tablet-focus.png": "sha256:42d21f578141b6b22e90682a03632469ebbb49059bb9af3386cda7d1d2bb5fec",
    ".design-harness/runs/20260801-tv-traffic-cohort-2/evidence/screenshots/digital-tablet-text-spacing.png": "sha256:65ad8ada0b5d9e913304cf4a69d859cbb78914b56e4f523f0d5fe39607e8ed59",
    ".design-harness/runs/20260801-tv-traffic-cohort-2/evidence/screenshots/laptop-desktop-error.png": "sha256:61d6912c801bf82fc85d4c4d5d371316eb6f2e00c46676d485988a02913ed9d2",
    ".design-harness/runs/20260801-tv-traffic-cohort-2/evidence/screenshots/laptop-desktop-loading.png": "sha256:ef15f6df4513993c91bb1351680a41ba9205b4a94991a7b20abcf4e36f9297d0",
    ".design-harness/runs/20260801-tv-traffic-cohort-2/evidence/screenshots/laptop-mobile-empty.png": "sha256:43faaf8030deb7b562dce67dbc983aff009e35827981fd702b7642ac5358251f",
    ".design-harness/runs/20260801-tv-traffic-cohort-2/evidence/screenshots/laptop-mobile-text-200.png": "sha256:eead003608fe2514864adcfbb9c0dfc9936f228ef54477036a13df223560b0c0",
    ".design-harness/runs/20260801-tv-traffic-cohort-2/evidence/screenshots/picture-desktop-success.png": "sha256:f87e287d76381e6535484254b913a0fb3685fa4878262d2bf172698db785c2e4",
    ".design-harness/runs/20260801-tv-traffic-cohort-2/evidence/screenshots/picture-mobile-disabled.png": "sha256:e4f2656b5f8a7a9b9c62a9d0b288982672c3b427a8917cfa02c775e82276bb96",
    ".design-harness/runs/20260801-tv-traffic-cohort-2/evidence/screenshots/production-digital-success.png": "sha256:58ff9cc8d44e71e619e388869dfc77176713e9b5165398f79ccce77857b64b7a",
    ".design-harness/runs/20260801-tv-traffic-cohort-2/evidence/screenshots/production-laptop-success.png": "sha256:a08c1e60b013956626a7665232c3f592faec3dffd76b171d997bb6e1c7e81c55",
    ".design-harness/runs/20260801-tv-traffic-cohort-2/evidence/screenshots/production-picture-success.png": "sha256:f87e287d76381e6535484254b913a0fb3685fa4878262d2bf172698db785c2e4",
    ".design-harness/runs/20260801-tv-traffic-cohort-2/evidence.json": "sha256:b38dbe3cd6c00eb8492263d60b9a099b341b9df925dfc4e42b12d398296439bd",
    ".design-harness/runs/20260801-tv-traffic-cohort-2/review.md": "sha256:f0a79cc73bf78240c26460eb4d372bf52c35ed9c6429c3f399a14a59c30187ea",
    ".design-harness/runs/20260801-tv-traffic-cohort-2/task.json": "sha256:3faf28bfd5907cf059887040f46545302506f9db2248443a96af76047a810a17",
    ".design-harness/runs/20260801-tv-traffic-cohort-2/visual-direction.md": "sha256:dbef8c03bf0cc885f77631f6aabc91a45593b29f6e792cd79f65cfd7d63de3d1"
  },
  "packet_hash": "sha256:d6000d60c4d4322a613fb80927f5e23f209ca316dcc95d16a5076c2a5e9f9e47"
}
