{
  "version": 1,
  "run_id": "20260902-growth-consolidation-20260902",
  "sealed_at": "2026-09-02T09:08:01.713729+00:00",
  "task_hash": "sha256:94e3cfa247845283a3309fc9a96618d3548156080526490bd4e274076a66c0e8",
  "evidence_hash": "sha256:02d11c082c5741ae1d026a11316b38a1b423f83cd4f7521a269c207c98bd2829",
  "files": {
    ".design-harness/config.json": "sha256:04072df9107eee519a90bbfd4b2e242e773a13cb6841e47e0d207cd2679128f5",
    ".design-harness/runs/20260902-growth-consolidation-20260902/SPEC.md": "sha256:dea416cda72a76012b177059bfeb94119f967e372e07952859836d02fa2eb745",
    ".design-harness/runs/20260902-growth-consolidation-20260902/brief.md": "sha256:d812844e86973acdc3daf7d28968cdb862268518b18c555a53978318cab68c30",
    ".design-harness/runs/20260902-growth-consolidation-20260902/component-map.md": "sha256:202049437e9ce0fa09a387f44b5edd206c5013b9d4ea41fcedd3be7c1bc2239a",
    ".design-harness/runs/20260902-growth-consolidation-20260902/discovery.md": "sha256:b5630ca36f55cd355559d05c9433e082b7bb2aff965dd84038be7f5ba4eff7fd",
    ".design-harness/runs/20260902-growth-consolidation-20260902/evidence/drift-report.json": "sha256:8a67adb7e58ff75281262048ab1da32338e24b1174f19504c9ec7ae884388f82",
    ".design-harness/runs/20260902-growth-consolidation-20260902/evidence.json": "sha256:02d11c082c5741ae1d026a11316b38a1b423f83cd4f7521a269c207c98bd2829",
    ".design-harness/runs/20260902-growth-consolidation-20260902/review.md": "sha256:dbeaca7657b12dbc113caecc28151023456686aab81b7cdfe7379b1cc0eccce0",
    ".design-harness/runs/20260902-growth-consolidation-20260902/screenshots/default-desktop.png": "sha256:1dd41749600716809a852b9abdc3ace58f8284d55f5a7b5e1a89d3899599bc6e",
    ".design-harness/runs/20260902-growth-consolidation-20260902/screenshots/default-mobile.png": "sha256:0442d5ea7ca91f1dac52b74264f533dedbffdfe85487b69afd4c94175772f29f",
    ".design-harness/runs/20260902-growth-consolidation-20260902/screenshots/default-tablet.png": "sha256:d337d8dc0898230f467d644c83dae428ec28a696f3d2193d068f74771eac7d90",
    ".design-harness/runs/20260902-growth-consolidation-20260902/task.json": "sha256:94e3cfa247845283a3309fc9a96618d3548156080526490bd4e274076a66c0e8",
    ".design-harness/runs/20260902-growth-consolidation-20260902/visual-direction.md": "sha256:e4fd30859c602b53994e3445854cc16e32f68b9df1ecdfca6a2f28537b4a80e7"
  },
  "packet_hash": "sha256:bfab9c3b6da59e533b5cdc6f924a2065544d2c0e1693664b3e8a4f0ed2c9b85c"
}
