{
  "version": 1,
  "run_id": "20260801-cohort-5-web-utilities",
  "sealed_at": "2026-08-01T17:11:09.272640+00:00",
  "task_hash": "sha256:cb5094949344a0b95f5cbda9622b95853381623b8ac178880ef0c4b57df2b95c",
  "evidence_hash": "sha256:1bf69ff2d915740262cebbc272994f618804a5a66d902ab386a47ffbb58bb017",
  "files": {
    ".design-harness/config.json": "sha256:04072df9107eee519a90bbfd4b2e242e773a13cb6841e47e0d207cd2679128f5",
    ".design-harness/runs/20260801-cohort-5-web-utilities/SPEC.md": "sha256:8b615e792139f9231b84a991b5dcca4587804269c282c68a06efa698ee3f8ee0",
    ".design-harness/runs/20260801-cohort-5-web-utilities/brief.md": "sha256:443bf21a90f7ee7adee341ae7142370f404935b173cb9fe8444b4f0330ad340c",
    ".design-harness/runs/20260801-cohort-5-web-utilities/component-map.md": "sha256:b18a6d23255b8e11e905ff9fac802207f7a03e83018529791d833e8b1708b984",
    ".design-harness/runs/20260801-cohort-5-web-utilities/discovery.md": "sha256:6160dd33e234ce569e5888409611ecc20552979c7ea4a77fb61d11b7c6672ed9",
    ".design-harness/runs/20260801-cohort-5-web-utilities/evidence/drift-report.json": "sha256:6e6993d0572140d183e7bb8df0354a3b56a2dc02e9e84f556711f0a78fd35dfc",
    ".design-harness/runs/20260801-cohort-5-web-utilities/evidence/screenshots/cleaning-desktop-loading.png": "sha256:79c6cc8c2153608011a6756060cacef8dfef4b52f8fd2e574db353cd0fffcf52",
    ".design-harness/runs/20260801-cohort-5-web-utilities/evidence/screenshots/cleaning-mobile-success.png": "sha256:c231304a18b340ad17d5ad10b38a491027c093810aff9d428540a0de9ae1ab44",
    ".design-harness/runs/20260801-cohort-5-web-utilities/evidence/screenshots/cleaning-mobile-text-200.png": "sha256:a3bda1670c29ba3693cc803d2d71de6a366bf24f7813da6e184828e5b37c9017",
    ".design-harness/runs/20260801-cohort-5-web-utilities/evidence/screenshots/cleaning-tablet-default.png": "sha256:b812f4144bb2a49c559e77ed269bbadbe220e20df76fe9845de5a638deacf1fa",
    ".design-harness/runs/20260801-cohort-5-web-utilities/evidence/screenshots/cleaning-tablet-needs-check.png": "sha256:961bd15821eadbd3b5a3fbf137566885cce019fb07e55a323648deac708ab22f",
    ".design-harness/runs/20260801-cohort-5-web-utilities/evidence/screenshots/smart-desktop-error.png": "sha256:3e25ddad75ddfc00c22222594e49516074038364b10eec8ac1fc19ffd5d47415",
    ".design-harness/runs/20260801-cohort-5-web-utilities/evidence/screenshots/smart-desktop-success.png": "sha256:1dbdc777719429f53234a02d646d5466e9034eaee2f29f50d21de7bb97a2ad06",
    ".design-harness/runs/20260801-cohort-5-web-utilities/evidence/screenshots/smart-mobile-disabled.png": "sha256:b4e5d135c7c4aa46c5c2c7a819dfb274c114353ea02bc8f270b74a7071de471c",
    ".design-harness/runs/20260801-cohort-5-web-utilities/evidence/screenshots/smart-mobile-service.png": "sha256:7b3b04515eb254758286faa5c0cee83733be716fa3bdb62b698a5db890a77011",
    ".design-harness/runs/20260801-cohort-5-web-utilities/evidence/screenshots/soundbar-desktop-success.png": "sha256:f15e9aa8d00d24e225906a06f7e985964a21a2da306f138a431c1809ad7a62b7",
    ".design-harness/runs/20260801-cohort-5-web-utilities/evidence/screenshots/soundbar-mobile-empty.png": "sha256:da7be9dd4c8f9397385dad89975a9036d875849fa8341793e84e285153f70b23",
    ".design-harness/runs/20260801-cohort-5-web-utilities/evidence/screenshots/soundbar-tablet-external.png": "sha256:97ed7c8fc8c82e2a64dacf25cebcc219e30ffc66a11c3118a273cce9c3e4275f",
    ".design-harness/runs/20260801-cohort-5-web-utilities/evidence/screenshots/soundbar-tablet-focus.png": "sha256:ed0de37cb1d782d891409dc4f15049ed9be65cab439b67e3f9dda42ceb4f1076",
    ".design-harness/runs/20260801-cohort-5-web-utilities/evidence/screenshots/soundbar-tablet-text-spacing.png": "sha256:6289c8d37e89f6928dd4e08c38793075907a9ef2bd851f9c491c6c59853c6773",
    ".design-harness/runs/20260801-cohort-5-web-utilities/evidence.json": "sha256:1bf69ff2d915740262cebbc272994f618804a5a66d902ab386a47ffbb58bb017",
    ".design-harness/runs/20260801-cohort-5-web-utilities/review.md": "sha256:a95f4d7f69d06a8629de65d8407b0217692cb5886f71ee57fed1ff575fb5e798",
    ".design-harness/runs/20260801-cohort-5-web-utilities/task.json": "sha256:cb5094949344a0b95f5cbda9622b95853381623b8ac178880ef0c4b57df2b95c",
    ".design-harness/runs/20260801-cohort-5-web-utilities/visual-direction.md": "sha256:62bbae4fb1106f9339c64113cfa7e63b401905d439b58c1a4fe9c132a9891931"
  },
  "packet_hash": "sha256:214a32520da10901e8acab8b9557c2021b9dbe07dd779fede8055d060e6cbb6d"
}
