{
  "version": 1,
  "run_id": "20260826-pagespeed-stable-islands",
  "sealed_at": "2026-08-26T07:26:17.538491+00:00",
  "task_hash": "sha256:a1612b248e1c3bdfa87be6c18e9afbb3f431535eb8568b61c1d6b270a842d290",
  "evidence_hash": "sha256:aa283abb7ca2cfd7ff9969c8dbf63875aa6cfed8c67c29d5f8219f585a08dbca",
  "files": {
    ".design-harness/config.json": "sha256:04072df9107eee519a90bbfd4b2e242e773a13cb6841e47e0d207cd2679128f5",
    ".design-harness/runs/20260826-pagespeed-stable-islands/SPEC.md": "sha256:ef0c279f1dc8df4a0f4cad773657e92d90a676e691ef3632425bb1b0800405a2",
    ".design-harness/runs/20260826-pagespeed-stable-islands/brief.md": "sha256:9e163706a5db4d281695124ebdbeaaa4e3e32f0f2483f0363c47f5f1150d55e9",
    ".design-harness/runs/20260826-pagespeed-stable-islands/component-map.md": "sha256:9b1b9fdc9fb9dd4478f749df9380b09a167544259444badc9faca657af6ce5e3",
    ".design-harness/runs/20260826-pagespeed-stable-islands/discovery.md": "sha256:2e58ec3fabe0ab824414970d78a5af1a6617f2e2c3ce3832c6d1ebc418ddcfba",
    ".design-harness/runs/20260826-pagespeed-stable-islands/evidence/drift-report.json": "sha256:07eb6339bd9f8ebab49f8e28ae56743d157ed9925b44694068537d5a5c2a8727",
    ".design-harness/runs/20260826-pagespeed-stable-islands/evidence.json": "sha256:aa283abb7ca2cfd7ff9969c8dbf63875aa6cfed8c67c29d5f8219f585a08dbca",
    ".design-harness/runs/20260826-pagespeed-stable-islands/home-desktop.png": "sha256:75b6f705a7a577c9a06293661bcbb0788c573cdc296318cf71a84dd2e822ba7a",
    ".design-harness/runs/20260826-pagespeed-stable-islands/home-mobile.png": "sha256:9df4d78cc74f45043d03fbde44ff0edc5366451392323d1134f6a2deb390481b",
    ".design-harness/runs/20260826-pagespeed-stable-islands/home-tablet.png": "sha256:1ca2176fe2fde34ac312cf6cbe1304016854288955806a94d3b10488794b028b",
    ".design-harness/runs/20260826-pagespeed-stable-islands/layout-stability-3runs.json": "sha256:6a712b943fa1cfb98fa8b53c226bb194bc0450ce7eec74c6771a5840ebaa56f3",
    ".design-harness/runs/20260826-pagespeed-stable-islands/layout-stability-cleanup-proof.json": "sha256:92e58f7d4ac4285c9fcb1fb13b245284cc5b4f9017284be477f6280a700fdbbc",
    ".design-harness/runs/20260826-pagespeed-stable-islands/model-desktop.png": "sha256:817e749141bf0766cad026a439ed5a1ef08e0cd37aa9f0b00efb09f7dafb7bfb",
    ".design-harness/runs/20260826-pagespeed-stable-islands/model-mobile.png": "sha256:3e8219f7013bb84594d0048770d11d529b86baf20248abc46879c16aab8c674c",
    ".design-harness/runs/20260826-pagespeed-stable-islands/model-tablet.png": "sha256:9805fbafa1313722489a584b12faee96609e34de3cb1ae3d8e44144fe71ea455",
    ".design-harness/runs/20260826-pagespeed-stable-islands/podbor-desktop.png": "sha256:a1cf9143e8a34178eae9bf39354d417a60e899a7eada55e61f478a7569ee7749",
    ".design-harness/runs/20260826-pagespeed-stable-islands/podbor-disabled.png": "sha256:033b836e4955576067ed9a6e7932b071805224770a3c99eb1a08a45da2da592b",
    ".design-harness/runs/20260826-pagespeed-stable-islands/podbor-empty.png": "sha256:ed8fdb76811f8fa7ba6a9d0cda1c6f1b9a8dd40066c44db2ba30e37b9fee2962",
    ".design-harness/runs/20260826-pagespeed-stable-islands/podbor-error.png": "sha256:4291620e9c44512fe091ed514966b88e55277b4907c99da05fcbd40aa0e8db03",
    ".design-harness/runs/20260826-pagespeed-stable-islands/podbor-focus.png": "sha256:cd5aceeda7d8fa6fc4e56b7488e976bb05a7086cbf9b03eea014adcd4ba2ed99",
    ".design-harness/runs/20260826-pagespeed-stable-islands/podbor-loading.png": "sha256:0706aa5b05198d608c10ad475793baceb317e7599d217b0754c43744194b48fe",
    ".design-harness/runs/20260826-pagespeed-stable-islands/podbor-mobile.png": "sha256:1830ea59fb0f76843f8fcf4ae9c41acb877030c564515cc2d1ad769b82b2f82e",
    ".design-harness/runs/20260826-pagespeed-stable-islands/podbor-success.png": "sha256:b4cfd8cd714d3760850e3a49780c8854baf5b62bbd5e530d6ed856b993ee1c4e",
    ".design-harness/runs/20260826-pagespeed-stable-islands/podbor-tablet.png": "sha256:ef8840c150c11859fefd5339d863f19e2520304e4271f83c8b9d3a7bf54b0583",
    ".design-harness/runs/20260826-pagespeed-stable-islands/review.md": "sha256:b9311c6d01feade1232dd920d2cfeebac6695fd5effcc3c2f9f0ce4aad4e073f",
    ".design-harness/runs/20260826-pagespeed-stable-islands/task.json": "sha256:a1612b248e1c3bdfa87be6c18e9afbb3f431535eb8568b61c1d6b270a842d290",
    ".design-harness/runs/20260826-pagespeed-stable-islands/visual-direction.md": "sha256:ded830bf4257c7b365b1cf4ce5a66101c2f6af3811e6f6bc9b3c12d718832515"
  },
  "packet_hash": "sha256:e613519b9b99bbcd55f25938847357d9a5600a37f1233e47d93ec302b7cb2b77"
}
