{
  "version": 1,
  "run_id": "20260826-tool-analytics-notice",
  "sealed_at": "2026-08-26T09:05:02.100744+00:00",
  "task_hash": "sha256:4628d6cd1113591a4d3b8a42b5fee2fe8d52b06b13374ff03528dc76453180ee",
  "evidence_hash": "sha256:1c6e7dce55d717cb861e47d46fcc347b21a0fd0d9954dc34ec582c359cad2fe4",
  "files": {
    ".design-harness/config.json": "sha256:04072df9107eee519a90bbfd4b2e242e773a13cb6841e47e0d207cd2679128f5",
    ".design-harness/runs/20260826-tool-analytics-notice/SPEC.md": "sha256:1813f870e17e25baa4ea4309b9c56bf0712dab94669c3994bbf49fc15c6fe64f",
    ".design-harness/runs/20260826-tool-analytics-notice/brief.md": "sha256:19eda921872d2da163a56fe72b514081bcbf9369badcfd20c73f0e79bf553217",
    ".design-harness/runs/20260826-tool-analytics-notice/component-map.md": "sha256:9526e7141c313b41e9b672afcb9c3c5e2f71773bc48ced133b4faa42d99549a7",
    ".design-harness/runs/20260826-tool-analytics-notice/discovery.md": "sha256:80b4c29e46f45dc4aa8fa2981e62892371b1a9ae91dc38d9f4c40fb77e314756",
    ".design-harness/runs/20260826-tool-analytics-notice/evidence/commands/analytics-tests.txt": "sha256:3b5639a7ad804079fccf25e35ff305c492cf62c12bfa911b646fcf134ab71734",
    ".design-harness/runs/20260826-tool-analytics-notice/evidence/commands/notice-contract.txt": "sha256:c58d07e549ad6c4355f0505de2538179e52db81746bc11b60c21248deb853cb8",
    ".design-harness/runs/20260826-tool-analytics-notice/evidence/commands/release.txt": "sha256:995272613144cf10faeb85f89056bb15657a62d3dc8a2ee32cbcb72f81589bc1",
    ".design-harness/runs/20260826-tool-analytics-notice/evidence/commands/web-tests.txt": "sha256:8f8b4964942592db5f6b82a2f03132ad6c3185796d17230aed535f7edda82231",
    ".design-harness/runs/20260826-tool-analytics-notice/evidence/drift-report.json": "sha256:93329df1c7508261b47080b03b2e24e3bb4c494dd8dd27fae643b67952911169",
    ".design-harness/runs/20260826-tool-analytics-notice/evidence/screenshots/default-desktop.png": "sha256:40f7ae89be386b6ad71f120030077400d50e5984b4d36a8acffeac16ff61ea0d",
    ".design-harness/runs/20260826-tool-analytics-notice/evidence/screenshots/default-mobile.png": "sha256:830b17d9e2771dcda4f6656f0973f9974f416903bb028724d5c1e72193c2a3a1",
    ".design-harness/runs/20260826-tool-analytics-notice/evidence/screenshots/default-tablet.png": "sha256:846514ee6c71f2e34061fd1591820951c63acd3655bb59301fa50f69cc315ce2",
    ".design-harness/runs/20260826-tool-analytics-notice/evidence/screenshots/disabled-mobile.png": "sha256:f8fe4beb92046da2953cf8f4b8620c3895a8260e4cc7457aaaa7e72273ce28d9",
    ".design-harness/runs/20260826-tool-analytics-notice/evidence/screenshots/focus-tablet.png": "sha256:4d83a9f730f91004f5ad5f5751c71105209a6f314b0fc68a089bacba20463d3c",
    ".design-harness/runs/20260826-tool-analytics-notice/evidence/screenshots/reflow-mobile.png": "sha256:ea663c6e36ed6d7282efa9696965e45be33a9d3267fa018aa3fa6154e9b89892",
    ".design-harness/runs/20260826-tool-analytics-notice/evidence.json": "sha256:1c6e7dce55d717cb861e47d46fcc347b21a0fd0d9954dc34ec582c359cad2fe4",
    ".design-harness/runs/20260826-tool-analytics-notice/review.md": "sha256:8c936c10d447e61c3bbda5a9bc8b91db8b69b11f65890a82af5519788619b4c8",
    ".design-harness/runs/20260826-tool-analytics-notice/task.json": "sha256:4628d6cd1113591a4d3b8a42b5fee2fe8d52b06b13374ff03528dc76453180ee",
    ".design-harness/runs/20260826-tool-analytics-notice/visual-direction.md": "sha256:ec75832143c7038bc5401dade8ae70ce53336462eb719c44371ee5689c2361b1"
  },
  "packet_hash": "sha256:a3ce86110a0e612ae58eced1090dfbbe135a55128672e02d752b3dd1cb206df4"
}
