{
  "version": 1,
  "run_id": "20260903-seo-tools-20260903",
  "sealed_at": "2026-09-03T09:00:48.790936+00:00",
  "task_hash": "sha256:3e1df62c5204614be519c86d3e31d29a7e1883e88dc43ee0e5772e54a990e4bf",
  "evidence_hash": "sha256:0b0fa117d13cee3606f648177ffbad8e91ed68d22a03e838519de21bb44c204a",
  "files": {
    ".design-harness/config.json": "sha256:04072df9107eee519a90bbfd4b2e242e773a13cb6841e47e0d207cd2679128f5",
    ".design-harness/runs/20260903-seo-tools-20260903/SPEC.md": "sha256:329517b705c20c39eea89b45f82f27b81b0ac0adcf5f3d0de8a7b9bf1ed0e864",
    ".design-harness/runs/20260903-seo-tools-20260903/brief.md": "sha256:d7831cdf92d1d1e95693ecc03b5264adcaffe25d8e7896d21a541c48e1ff08c4",
    ".design-harness/runs/20260903-seo-tools-20260903/component-map.md": "sha256:e77369f455538d98e15f64e34169eb0f4ae02e360f617b4c9e76b7844ccaf7f6",
    ".design-harness/runs/20260903-seo-tools-20260903/desktop.png": "sha256:d759082791fd196bca7b85015134b823a2828ef73deb333356677ebfbec6afc0",
    ".design-harness/runs/20260903-seo-tools-20260903/discovery.md": "sha256:2de171c159779d8518d0846a6cc71a8131622b70b659c430d29a52f0a26e26bc",
    ".design-harness/runs/20260903-seo-tools-20260903/evidence/drift-report.json": "sha256:d888322073fa045564d7abd35d88076db974be57e80534164f451daecc655462",
    ".design-harness/runs/20260903-seo-tools-20260903/evidence.json": "sha256:0b0fa117d13cee3606f648177ffbad8e91ed68d22a03e838519de21bb44c204a",
    ".design-harness/runs/20260903-seo-tools-20260903/mobile.png": "sha256:1d17c116e19bd13e0f10a4241b4d7a5f611db2dd5fe146460ceebe1d42349fc4",
    ".design-harness/runs/20260903-seo-tools-20260903/review.md": "sha256:40ae06b11dc601eb9cf40037ce4a10b32fff15b052de560d9af71e23647b0319",
    ".design-harness/runs/20260903-seo-tools-20260903/tablet.png": "sha256:64b1eda82123a191c21ac92d04d6b7135d0fccd40a518b81bf905e4bc74acfb1",
    ".design-harness/runs/20260903-seo-tools-20260903/task.json": "sha256:3e1df62c5204614be519c86d3e31d29a7e1883e88dc43ee0e5772e54a990e4bf",
    ".design-harness/runs/20260903-seo-tools-20260903/visual-direction.md": "sha256:1b9aabd14623de29dcdce893d3ac49d49c61a14a4dd217d2babc96c0ee7f14dc"
  },
  "packet_hash": "sha256:f7a448b0076b516a08fe02f9e31d23cf93a123b4bac3c483394cb4a6a91f4353"
}
