{
  "version": 1,
  "run_id": "20260801-tv-no-signal-traffic-wedge",
  "sealed_at": "2026-08-01T12:22:49.067151+00:00",
  "task_hash": "sha256:ec5a3a39628c3c3f4f524fbf0d6e3aef90aa971278bac2c1f6ca19260f259ce2",
  "evidence_hash": "sha256:40e6d37fda86a89b625a320fecdd4e3e4823592fbe20e7cef82cf2ec1bbd0647",
  "files": {
    ".design-harness/config.json": "sha256:04072df9107eee519a90bbfd4b2e242e773a13cb6841e47e0d207cd2679128f5",
    ".design-harness/runs/20260801-tv-no-signal-traffic-wedge/SPEC.md": "sha256:03c2cf936e013cd2085e74c74536617d718f0c7ec834e7e053b10f9d36653ea3",
    ".design-harness/runs/20260801-tv-no-signal-traffic-wedge/brief.md": "sha256:e0bb71be6ed0b1ca3693c081853d14f6a193df707d7b5d7ebe7596504afef3e8",
    ".design-harness/runs/20260801-tv-no-signal-traffic-wedge/component-map.md": "sha256:82f0f108d20ab22d51682dbb1254297e432f254d0ee2b8265f0d2da359ab21a5",
    ".design-harness/runs/20260801-tv-no-signal-traffic-wedge/default-desktop.png": "sha256:2f9ab9fd4045dad374ef2115dd8bdc29ec9edf8dd6a421034de12af5a1c6819d",
    ".design-harness/runs/20260801-tv-no-signal-traffic-wedge/disabled-tablet.png": "sha256:a3860a2f002aff78f0784269216d212646dd182e98ad7248eb809f09ba2c477e",
    ".design-harness/runs/20260801-tv-no-signal-traffic-wedge/discovery.md": "sha256:5aeed8e6963f36fe3064cde9cd6c626899d00c375afe59ddd24e9d26afb2ba8c",
    ".design-harness/runs/20260801-tv-no-signal-traffic-wedge/empty-mobile.png": "sha256:bb11b72d8c650cd098dd0cca87ecee501d59d868a54c397eff0aba2932eade05",
    ".design-harness/runs/20260801-tv-no-signal-traffic-wedge/error-mobile.png": "sha256:cb67394c1aea905bb09be563f5d51d72c205c94f4f1027ebeb432d40bbdf3b79",
    ".design-harness/runs/20260801-tv-no-signal-traffic-wedge/evidence/drift-report.json": "sha256:19180ed13a33f0a05e07ef5aaa53dc5907ac0079ccbcd5cb90ef6a1b0fcfe31e",
    ".design-harness/runs/20260801-tv-no-signal-traffic-wedge/evidence.json": "sha256:40e6d37fda86a89b625a320fecdd4e3e4823592fbe20e7cef82cf2ec1bbd0647",
    ".design-harness/runs/20260801-tv-no-signal-traffic-wedge/focus-tablet.png": "sha256:c991f1a659971bd8a76f308c50f8360835c682aa8dec87de9f5f72c40bc62ccf",
    ".design-harness/runs/20260801-tv-no-signal-traffic-wedge/loading-desktop.png": "sha256:85fd52cc56e4c70fdc906e95ee2f2213e9734a7fae7780c9aea04911f5a7b5e1",
    ".design-harness/runs/20260801-tv-no-signal-traffic-wedge/needs-service-mobile.png": "sha256:579f76934372bc3b88c0e0ef79c2fe8385aca46796ef79c9c05861824318361e",
    ".design-harness/runs/20260801-tv-no-signal-traffic-wedge/provider-path-desktop.png": "sha256:0f0c47014e6fc4f80433a87b47a6a31205c7be653049df1c9f66fae0032a2836",
    ".design-harness/runs/20260801-tv-no-signal-traffic-wedge/retry-mobile.png": "sha256:1479fc22b2c613b35d83b61db1367302d831a8b9a409589d1a026bf590701dda",
    ".design-harness/runs/20260801-tv-no-signal-traffic-wedge/review.md": "sha256:bf08be78b771449d0368943b767151e76355e39fbb7d75cc138136f7ffdd70ab",
    ".design-harness/runs/20260801-tv-no-signal-traffic-wedge/spacing-mobile.png": "sha256:ad3cd95fc59458d532f4809e726b277f64ec03ae5935cba59499579040a80171",
    ".design-harness/runs/20260801-tv-no-signal-traffic-wedge/success-desktop.png": "sha256:293b2b10e6377854151ce3eb5b71409afac6aa3ec7eb1aaa3902776cbe9a1ddb",
    ".design-harness/runs/20260801-tv-no-signal-traffic-wedge/task.json": "sha256:ec5a3a39628c3c3f4f524fbf0d6e3aef90aa971278bac2c1f6ca19260f259ce2",
    ".design-harness/runs/20260801-tv-no-signal-traffic-wedge/unknown-source-mobile.png": "sha256:9e4343442fade2d1f3d690421ed5b538c8098b05019d6561ad45a69f604eaf7e",
    ".design-harness/runs/20260801-tv-no-signal-traffic-wedge/visual-direction.md": "sha256:671e0229d01f7b828d79962013da2c0818f0daf7cea4747624e22e2b854719ea",
    ".design-harness/runs/20260801-tv-no-signal-traffic-wedge/zoom-tablet.png": "sha256:d231525acf1cb2dba5e7d407bbe98c668672ec385732182a17262311fa941862"
  },
  "packet_hash": "sha256:c2046b2bbafe2b2893d9056ae1642c9192c1d937d93a28acfeb2fab6b63b1bb3"
}
