{
  "version": 1,
  "run_id": "20260923-internal-100-visual-ux",
  "sealed_at": "2026-09-23T22:37:24.710875+00:00",
  "task_hash": "sha256:cfd135f488d22f609c6f93ef0f3e0c553fed5cd27191643b6548e479abbc35f6",
  "evidence_hash": "sha256:fbbf0979671ebc0c46e4a6dc57d2fbd488aa08449ba1ab86e7f427706fa95ad0",
  "files": {
    ".design-harness/config.json": "sha256:04072df9107eee519a90bbfd4b2e242e773a13cb6841e47e0d207cd2679128f5",
    ".design-harness/runs/20260923-internal-100-visual-ux/SPEC.md": "sha256:9f69bf46c17cf048fa48272da8b770a3626001ae005957e5a37ec746ecfc6f1e",
    ".design-harness/runs/20260923-internal-100-visual-ux/brief.md": "sha256:d9683940919e0551fb349cff0e687bf92443cd5d32556e972391109a682adcc0",
    ".design-harness/runs/20260923-internal-100-visual-ux/component-map.md": "sha256:ec01b7f2f7e4fd424050f995bffa87617e21c00bb56e13fc09d2f2e23a360c47",
    ".design-harness/runs/20260923-internal-100-visual-ux/connection-desktop-final.png": "sha256:1dee29d99051d805301db42f940aca39b1576df2198e42b1d3197e818db3c405",
    ".design-harness/runs/20260923-internal-100-visual-ux/connection-mobile-final.png": "sha256:1a080ebf016c6ded97213a41201bc82dc35564f5a703b4346d83297333756adc",
    ".design-harness/runs/20260923-internal-100-visual-ux/connection-mobile.png": "sha256:eb7b0a5fcaeb54d3d529e9a34679d1114f1ee5353e5b8cb41d6a7ba19090a5a4",
    ".design-harness/runs/20260923-internal-100-visual-ux/connection-tablet-final.png": "sha256:dd64be78bc7f04fd6196308c7258a06ffdfe512ffdf8778c0cf6e08d8aaaebf6",
    ".design-harness/runs/20260923-internal-100-visual-ux/connection-tablet-v2.png": "sha256:41522e18950461ccaef6510df9ef85b207c5d62de939c044ed1178b76d4fb7d9",
    ".design-harness/runs/20260923-internal-100-visual-ux/diagnostics-focus-final.png": "sha256:c88bd3f7f39b20bdfa46418f090a7af1f9c1cc412c2f105d6f856c9767da5f37",
    ".design-harness/runs/20260923-internal-100-visual-ux/diagnostics-focus-v2.png": "sha256:6257f2789ebd8d8ec48672471617ca7496e37aefb1fefbb0105b79d949954064",
    ".design-harness/runs/20260923-internal-100-visual-ux/diagnostics-mobile-final.png": "sha256:6b36becc0cf9f94f56781c720b0ab56aae72bf2609dbc3bd5a202c4c860a9fe1",
    ".design-harness/runs/20260923-internal-100-visual-ux/diagnostics-mobile.png": "sha256:9b4522d995eb120b9d19266675798fc2961c6773765b5020e15df98a63f9401b",
    ".design-harness/runs/20260923-internal-100-visual-ux/diagnostics-zoom200-final.png": "sha256:b370fed63d36851b2f963e131ef20468b6c332545529b600026d7709f9f8ec34",
    ".design-harness/runs/20260923-internal-100-visual-ux/diagnostics-zoom200-v2.png": "sha256:c463d3ca7890e12627d9246899289d7f1fc32af863df99706c07a2a239a0e75b",
    ".design-harness/runs/20260923-internal-100-visual-ux/discovery.md": "sha256:34cc3ac6a6c28ff47ff2c85cf4f8220efceb5f79b6c3aeace6df4245efe33b87",
    ".design-harness/runs/20260923-internal-100-visual-ux/display-desktop.png": "sha256:99555e9fb4736620c8a5360cc0d17cf10e08756e41e6fd0a6be4b25d22834287",
    ".design-harness/runs/20260923-internal-100-visual-ux/evidence/assets/internal-connection.webp": "sha256:22b640386765697495b08efd5ced58cc3b855277abeb8847148f66e8cbb4e7f3",
    ".design-harness/runs/20260923-internal-100-visual-ux/evidence/assets/internal-diagnostics.webp": "sha256:45f093198bedb6d6b8580d0080c2d26ffd04f2104d4e539bbec5e6ae3721193c",
    ".design-harness/runs/20260923-internal-100-visual-ux/evidence/assets/internal-display.webp": "sha256:1e96810801599ea5623502a5ecf5882e0094c7fc221e4e545e295a7129b7f063",
    ".design-harness/runs/20260923-internal-100-visual-ux/evidence/assets/internal-inspection.webp": "sha256:27947057748530b7f72acb35f21b630bcfb0df2f62996ed75f2d5b2d85f75dd3",
    ".design-harness/runs/20260923-internal-100-visual-ux/evidence/assets/internal-settings.webp": "sha256:06dfb9f5d5cdbbae8a9dbacb241629cd18ff01f9e87198a6607413d9c46fd606",
    ".design-harness/runs/20260923-internal-100-visual-ux/evidence/assets/internal-stand.webp": "sha256:fba38aea028ac291273d7f3ea7d1aab7f82da39c5d768ee348c1a708c6e884b1",
    ".design-harness/runs/20260923-internal-100-visual-ux/evidence/assets/internal-transport.webp": "sha256:830ae1a15f7cf19196d93b5e2c0bc03d3943c2911d27477d0544ca6236f91266",
    ".design-harness/runs/20260923-internal-100-visual-ux/evidence/assets/internal-wireless.webp": "sha256:91346184f7160eadd18443ebea21b88b327a50a824e35e7e3b5274946c381670",
    ".design-harness/runs/20260923-internal-100-visual-ux/evidence/commands/build.log": "sha256:1207af4c9948e6b9997ba431ab91390162b73d74ae197a2d545231ffd368cad9",
    ".design-harness/runs/20260923-internal-100-visual-ux/evidence/commands/visual-cohort.log": "sha256:856286f1957d19e9b6405c1bf49dc2c66b0cce0eb4182961baaf076421fe89ae",
    ".design-harness/runs/20260923-internal-100-visual-ux/evidence/drift-report.json": "sha256:1e40aa1b73ba5bdfd633d37258d1f1a96ead63d93122f18c2607cd394a29e0f9",
    ".design-harness/runs/20260923-internal-100-visual-ux/evidence/prompts/evidence.xmp": "sha256:9a47b692961b2848a29d6c5f461d4b962c3b4145683baae144722fd345170360",
    ".design-harness/runs/20260923-internal-100-visual-ux/evidence/prompts/imagegen.md": "sha256:f7b73fb3e33d006943592fe829983fa9b853c6fa062e6b99bb9e548ac369e5c0",
    ".design-harness/runs/20260923-internal-100-visual-ux/evidence.json": "sha256:fbbf0979671ebc0c46e4a6dc57d2fbd488aa08449ba1ab86e7f427706fa95ad0",
    ".design-harness/runs/20260923-internal-100-visual-ux/inspection-mobile-final.png": "sha256:beecc2c3532cd7db49b587065c47f2a27305b69ab15e7045610cefd39cbc4a55",
    ".design-harness/runs/20260923-internal-100-visual-ux/model-desktop.png": "sha256:c46687429557694cc1977202bbbd8a86e0efe05d0c1d9389abdfb214abeaebf6",
    ".design-harness/runs/20260923-internal-100-visual-ux/review.md": "sha256:888bc09b29211d916b3198655715520e0cc559021d834aaaf2a130cbaacdde40",
    ".design-harness/runs/20260923-internal-100-visual-ux/settings-desktop-final.png": "sha256:b52ae5eff845df6e4e00771cd54146c7715cae5281b77d544028afb0545730a6",
    ".design-harness/runs/20260923-internal-100-visual-ux/settings-desktop-v2.png": "sha256:3e1be004474e4a4b793dea6a8b5e96cb15cbee52552d11161f61ad7473aa0967",
    ".design-harness/runs/20260923-internal-100-visual-ux/stand-mobile-v2.png": "sha256:8b8ef05395b9925d283d7dda9487abfacf6a3e8450d931c82f373c4a54b7b3c4",
    ".design-harness/runs/20260923-internal-100-visual-ux/task.json": "sha256:cfd135f488d22f609c6f93ef0f3e0c553fed5cd27191643b6548e479abbc35f6",
    ".design-harness/runs/20260923-internal-100-visual-ux/transport-desktop-v2.png": "sha256:d830b8adb9c681815022b80aae89bfa5840c3768b55979432b3b7287ab08daa2",
    ".design-harness/runs/20260923-internal-100-visual-ux/visual-direction.md": "sha256:16cc8e11aac7166047ac7387ae4b79e4cd3e172b4b29d8395d7e6273adbd4745",
    ".design-harness/runs/20260923-internal-100-visual-ux/wall-mobile-final.png": "sha256:971a230fd77cd729d47600a11fe345b7ffadd1e4377aef4b4c92a79a1edbe27a",
    ".design-harness/runs/20260923-internal-100-visual-ux/wireless-mobile-release.png": "sha256:38b215a5216bc3f992040a8cc2f3004e98cf842d7b512df623c31327afd80513",
    ".design-harness/runs/20260923-internal-100-visual-ux/wireless-mobile-v2.png": "sha256:38b215a5216bc3f992040a8cc2f3004e98cf842d7b512df623c31327afd80513"
  },
  "packet_hash": "sha256:40b68a0e11663280bd9aca76005f65418e40228bba4d022c68c273080483fade"
}
