{
  "version": 1,
  "run_id": "20260801-20260801-tv-diagnostics-cohort-4",
  "sealed_at": "2026-08-01T16:10:22.501355+00:00",
  "task_hash": "sha256:9ed29f5dd3b38e47668a70f98b740e25b0efdfcdf84c44a9b79bcfd4ab3921b1",
  "evidence_hash": "sha256:bccd309e29744ff2d6b70aea647b983d515ef896e369b7c616f2c6db1569d167",
  "files": {
    ".design-harness/config.json": "sha256:04072df9107eee519a90bbfd4b2e242e773a13cb6841e47e0d207cd2679128f5",
    ".design-harness/runs/20260801-20260801-tv-diagnostics-cohort-4/SPEC.md": "sha256:498c8762ccd7bea7e2f2ecbf17ad6f27d9d2c378e80fc08202c053c3e1dbf330",
    ".design-harness/runs/20260801-20260801-tv-diagnostics-cohort-4/brief.md": "sha256:2bbc1932c29345009e2acc339d95bbced318801cc35be5c2eb04def00becc67f",
    ".design-harness/runs/20260801-20260801-tv-diagnostics-cohort-4/component-map.md": "sha256:6e4d9b66a835622a9549b1a8def4752bb99b8b03251cdaebf10a6945eb1fefa9",
    ".design-harness/runs/20260801-20260801-tv-diagnostics-cohort-4/danger-result-mobile.png": "sha256:361661c43f288ad01c85d43bb0359f5d21f0f430b7b62d767af46c81ddcc3501",
    ".design-harness/runs/20260801-20260801-tv-diagnostics-cohort-4/danger-selected-mobile.png": "sha256:fbf2ea47ad8abc51851e62ffa491317d729714b94527b5fd0da811eb6b25ac74",
    ".design-harness/runs/20260801-20260801-tv-diagnostics-cohort-4/default-desktop.png": "sha256:9aeae3b9dbb76c462cd0388aecd4cb7a498796218505c44bdbc0b1388e6321b8",
    ".design-harness/runs/20260801-20260801-tv-diagnostics-cohort-4/disabled-tablet.png": "sha256:8fec0a8e0113ef62b67c9d66daf0afc1035a8047f478cc6891482e36bbf890e9",
    ".design-harness/runs/20260801-20260801-tv-diagnostics-cohort-4/discovery.md": "sha256:463e80943dc3ac13f6d49599f0a9a9b3fe80da725a381ce45e94c4f080fdb169",
    ".design-harness/runs/20260801-20260801-tv-diagnostics-cohort-4/empty-mobile.png": "sha256:890a1fe0619ccfa6e9b80d50769c8edcd942724d65a8f2653643046e1f6e1143",
    ".design-harness/runs/20260801-20260801-tv-diagnostics-cohort-4/error-mobile.png": "sha256:24cb8d64b2c74ca9755bef2e8f64a583fb834b13102f976d7ad465a8ed3f799e",
    ".design-harness/runs/20260801-20260801-tv-diagnostics-cohort-4/evidence/cmd-design.txt": "sha256:bfa858d64a42056e92eeda4358e96722d269bf28d3181641c63bae98af01bf27",
    ".design-harness/runs/20260801-20260801-tv-diagnostics-cohort-4/evidence/cmd-production-build.txt": "sha256:ecdeed4e4483c9657ec11393de136fe8ccd594365df59933b387c6a412696297",
    ".design-harness/runs/20260801-20260801-tv-diagnostics-cohort-4/evidence/cmd-production.txt": "sha256:592820c0d201c23fd288619cc2bbe4bdf54fd6124d2e7bcd4c78a6a6891063f4",
    ".design-harness/runs/20260801-20260801-tv-diagnostics-cohort-4/evidence/cmd-release-audits.txt": "sha256:1da8faed522a4c2c5ed1525b19a970edb94c9afb2e0acff9ff2eb168d1193533",
    ".design-harness/runs/20260801-20260801-tv-diagnostics-cohort-4/evidence/cmd-rust-cohort.txt": "sha256:40a83f611bd4412cf024c70d02850b9ae500c65f7e79a28f8d2f70b031d57c4a",
    ".design-harness/runs/20260801-20260801-tv-diagnostics-cohort-4/evidence/cmd-web-cohort.txt": "sha256:97e52e1bae4c3a2c6d876344c3a675b8148ff5719ee1eb3637f0a6530af3a3d0",
    ".design-harness/runs/20260801-20260801-tv-diagnostics-cohort-4/evidence/drift-report.json": "sha256:01e748e30a15840fce94c8aef35ca18c4e0894b3dd9dc286a9ca066f2eee6bee",
    ".design-harness/runs/20260801-20260801-tv-diagnostics-cohort-4/evidence.json": "sha256:bccd309e29744ff2d6b70aea647b983d515ef896e369b7c616f2c6db1569d167",
    ".design-harness/runs/20260801-20260801-tv-diagnostics-cohort-4/external-path-desktop.png": "sha256:89c6c24793832d8f4d6545f76a646dd01d7528df9bb889012e259d82a79490d5",
    ".design-harness/runs/20260801-20260801-tv-diagnostics-cohort-4/focus-tablet.png": "sha256:691661dedceca5fa0af140c181ed4126e793de2bc8dfc139a9ce037d8ef8eaf3",
    ".design-harness/runs/20260801-20260801-tv-diagnostics-cohort-4/home-diagnostics-desktop.png": "sha256:ffb4c9a8f382dac72b9eddd2e35aed16fe5072288232c9e170fa0e5080b64275",
    ".design-harness/runs/20260801-20260801-tv-diagnostics-cohort-4/home-diagnostics-mobile.png": "sha256:cb8fe4d53dc2e119967448a9967c8471eb59c5f1e95d5908beb282d737bdc908",
    ".design-harness/runs/20260801-20260801-tv-diagnostics-cohort-4/loading-desktop.png": "sha256:fd974e08c68be554f185d2a05ca51609688ca6c5c8461f2975a9f924baad6773",
    ".design-harness/runs/20260801-20260801-tv-diagnostics-cohort-4/needs-check-mobile.png": "sha256:2aa03c2221ee2ad000b490921649ed7eb7f9d0a357c57b788a7e38cec82ecd7b",
    ".design-harness/runs/20260801-20260801-tv-diagnostics-cohort-4/production-internet-focus-tablet.png": "sha256:691661dedceca5fa0af140c181ed4126e793de2bc8dfc139a9ce037d8ef8eaf3",
    ".design-harness/runs/20260801-20260801-tv-diagnostics-cohort-4/production-turns-off-danger-mobile.png": "sha256:361661c43f288ad01c85d43bb0359f5d21f0f430b7b62d767af46c81ddcc3501",
    ".design-harness/runs/20260801-20260801-tv-diagnostics-cohort-4/production-turns-off-default-desktop.png": "sha256:9aeae3b9dbb76c462cd0388aecd4cb7a498796218505c44bdbc0b1388e6321b8",
    ".design-harness/runs/20260801-20260801-tv-diagnostics-cohort-4/production-usb-success-desktop.png": "sha256:d69260f273f900614b446b448e34b6f62705bd3a37458aa85316da3f514966d0",
    ".design-harness/runs/20260801-20260801-tv-diagnostics-cohort-4/retry-mobile.png": "sha256:d387dd311ac8f3e5700d2e936222b247a4679d67f4eb847b386981a4c5aec372",
    ".design-harness/runs/20260801-20260801-tv-diagnostics-cohort-4/review.md": "sha256:947e6ac96d9ac40d64a015b0c21fdcd6d469aa270db7090224e465dead301cbb",
    ".design-harness/runs/20260801-20260801-tv-diagnostics-cohort-4/service-boundary-mobile.png": "sha256:1cac80cad168581141badddbdc359814142204ccb36d209c7bb17559d2600202",
    ".design-harness/runs/20260801-20260801-tv-diagnostics-cohort-4/spacing-mobile.png": "sha256:d31f00734af6443593fad1458e1ee5e41e127d872e20b6ebfab25aaa994731e9",
    ".design-harness/runs/20260801-20260801-tv-diagnostics-cohort-4/success-desktop.png": "sha256:0b7c772bb784e2c0f50ccd50a036f7237afd4cfcf9de4dd46cf2176152c14e64",
    ".design-harness/runs/20260801-20260801-tv-diagnostics-cohort-4/task.json": "sha256:9ed29f5dd3b38e47668a70f98b740e25b0efdfcdf84c44a9b79bcfd4ab3921b1",
    ".design-harness/runs/20260801-20260801-tv-diagnostics-cohort-4/unknown-result-mobile.png": "sha256:fdbf014d59c0b93dfbe1fadb5b0e8d5a5073a2b86e3b52ab1c0432258e341bbf",
    ".design-harness/runs/20260801-20260801-tv-diagnostics-cohort-4/visual-direction.md": "sha256:43b4b776284f27f549fafc645949e19e25f7c7b71299957a5b8e07b56bd6d5eb",
    ".design-harness/runs/20260801-20260801-tv-diagnostics-cohort-4/zoom-tablet.png": "sha256:353b9b0bf249303a8fdbadd44f0dc45b548e40481316c7cf936ec6cddf10bd70"
  },
  "packet_hash": "sha256:5278e22eeb30216b7a420c12873802bf0bef17a708c0c3bcbab8ac381b5d65af"
}
