{
  "version": 1,
  "run_id": "20260922-seo-10-20260922",
  "sealed_at": "2026-09-22T12:12:29.298238+00:00",
  "task_hash": "sha256:e82300949fed1a41b9cded3e828faa21c9f0f64d7379ee4d6fdd09059e0a908c",
  "evidence_hash": "sha256:d56edbc66f508fff7a395837a96059232747c67d85eb916b3aa68a934b35f3b6",
  "files": {
    ".design-harness/config.json": "sha256:04072df9107eee519a90bbfd4b2e242e773a13cb6841e47e0d207cd2679128f5",
    ".design-harness/runs/20260922-seo-10-20260922/SPEC.md": "sha256:2daed0461e7c60582ff969b247d0c535a95ebc4839cc48eb229c4fe760113786",
    ".design-harness/runs/20260922-seo-10-20260922/brief.md": "sha256:1d46a631372a3d4b69bb2daef3be93be76b957e2134660e41e1d00096e9a6517",
    ".design-harness/runs/20260922-seo-10-20260922/browser-results.json": "sha256:89d538436b39e890aefd47aafe257fcff2a1addadad7dc2ebaa8a14847663157",
    ".design-harness/runs/20260922-seo-10-20260922/component-map.md": "sha256:7d84a9bf5bff7fdc6fd2f96e98db2692813208d01b00405d5794a60be0163f37",
    ".design-harness/runs/20260922-seo-10-20260922/discovery.md": "sha256:eaa9b9ca1481f8863567db29aad369c3d8b80d3c08f97da4b0dff1fc4a599eb7",
    ".design-harness/runs/20260922-seo-10-20260922/evidence/drift-report.json": "sha256:1bd33ab2db75f871d90142736fa35968919148784579c34a84d62c8e7bdcf2c8",
    ".design-harness/runs/20260922-seo-10-20260922/evidence/screenshots/tv-airplay-failure-desktop-success.png": "sha256:76c6c62b78a744a8d0251a101dfaea2503172a93936dd8a334463876a3463bef",
    ".design-harness/runs/20260922-seo-10-20260922/evidence/screenshots/tv-airplay-failure-mobile-success.png": "sha256:a04493d0d15e46858ad5469e507c69bda945a096849824d783e2c9031e25a7f9",
    ".design-harness/runs/20260922-seo-10-20260922/evidence/screenshots/tv-airplay-failure-tablet-success.png": "sha256:67018ae6d131954d5197d73ab92b55168920f7859bb4d2c502b41d110a8c20b3",
    ".design-harness/runs/20260922-seo-10-20260922/evidence/screenshots/tv-arc-no-sound-desktop-success.png": "sha256:5de0a2f40fdf431198ecc19b8586c7a9651e21aee184f8e2e0372bf5da710a7a",
    ".design-harness/runs/20260922-seo-10-20260922/evidence/screenshots/tv-arc-no-sound-mobile-success.png": "sha256:92d8765607a293937d6fea5c1cfff94b554c535a5ca5389142564fbbf935d2fe",
    ".design-harness/runs/20260922-seo-10-20260922/evidence/screenshots/tv-arc-no-sound-tablet-success.png": "sha256:1bcdd543388cf77c8e83a165da995c2b3c8a21fd1e9b8cc794b18b2b10e454bf",
    ".design-harness/runs/20260922-seo-10-20260922/evidence/screenshots/tv-cam-module-desktop-success.png": "sha256:b2d81f8fac06e38abea7955d622019ccfea4fa9b852b7a447451d4d11985d353",
    ".design-harness/runs/20260922-seo-10-20260922/evidence/screenshots/tv-cam-module-mobile-success.png": "sha256:3e3c623cbce90cf5a06c9f59791bf31e0206ded97620e35db3a951d373f28434",
    ".design-harness/runs/20260922-seo-10-20260922/evidence/screenshots/tv-cam-module-tablet-success.png": "sha256:4995501f3704ce157860f7fbf8dfb9bb3330cdb952f7b7971f5844259fb5c7fd",
    ".design-harness/runs/20260922-seo-10-20260922/evidence/screenshots/tv-channel-order-desktop-success.png": "sha256:76ed6b5b6e2f81e242c3de297e6155e11653230c56241ad75626f6fe1e67772e",
    ".design-harness/runs/20260922-seo-10-20260922/evidence/screenshots/tv-channel-order-mobile-success.png": "sha256:0a11f2d6bb8a65f0317878570222d7396c7726a42442394c69e1bf8c907f64bd",
    ".design-harness/runs/20260922-seo-10-20260922/evidence/screenshots/tv-channel-order-tablet-success.png": "sha256:c632acbe5f25bbce3dfe9a4640c405cb6104d460e6a4359d4a9d661e6a95641c",
    ".design-harness/runs/20260922-seo-10-20260922/evidence/screenshots/tv-dlna-desktop-success.png": "sha256:48c701a6b30fb2cf8bfee8f47d5ae6cddb84dab3a04ce98f41ec0654357d41f8",
    ".design-harness/runs/20260922-seo-10-20260922/evidence/screenshots/tv-dlna-mobile-success.png": "sha256:6079a75f3073026437f84608ab838b3e4abba4086a98eb7d77978d5b54274f57",
    ".design-harness/runs/20260922-seo-10-20260922/evidence/screenshots/tv-dlna-tablet-success.png": "sha256:235dc9e504cceb13eeecf9599043067c12e05cc6b31ab5f2272402b07161fea2",
    ".design-harness/runs/20260922-seo-10-20260922/evidence/screenshots/tv-hdmi-cec-desktop-success.png": "sha256:69a0afb4f6df5805d50da690476d442a0b7a654e339e7628a2860c116da8adb4",
    ".design-harness/runs/20260922-seo-10-20260922/evidence/screenshots/tv-hdmi-cec-mobile-success.png": "sha256:ea7a0e8fbdeb9ecba10dad4bf7d43a46469811cc0ccfda834ed292bdb501ec71",
    ".design-harness/runs/20260922-seo-10-20260922/evidence/screenshots/tv-hdmi-cec-tablet-success.png": "sha256:03f234e96845b25a31d751755052a34eaa95c0e5d916318fb7f1b18fb215b12e",
    ".design-harness/runs/20260922-seo-10-20260922/evidence/screenshots/tv-pin-reset-desktop-success.png": "sha256:04308ae3cf2ab06e1beb7d7b88401dc5473950a82a90d214c21ad6a7253069da",
    ".design-harness/runs/20260922-seo-10-20260922/evidence/screenshots/tv-pin-reset-mobile-success.png": "sha256:353ea0efa8e04a2ef4bc3faaa949e740b4a95237cb14a0fac0f52b6ce385d1fa",
    ".design-harness/runs/20260922-seo-10-20260922/evidence/screenshots/tv-pin-reset-tablet-success.png": "sha256:9d2ce27337d91eddd9cd52f546db93b23ac4ec4077b74b1353402cb0d25ba3ba",
    ".design-harness/runs/20260922-seo-10-20260922/evidence/screenshots/tv-transport-desktop-success.png": "sha256:c00e1c5db3eb18768b8c627746c14b3fbd41b50476e0e6c3fb5100ef892964fb",
    ".design-harness/runs/20260922-seo-10-20260922/evidence/screenshots/tv-transport-mobile-success.png": "sha256:cf491422490c107d7159dc47adbe8db3967a6ca3b8d6461e8af31da4ccdd39de",
    ".design-harness/runs/20260922-seo-10-20260922/evidence/screenshots/tv-transport-tablet-success.png": "sha256:61a2af62d2366070501fd5efef8988025bbdec65d9c927f4a0416ec5bb1d6c54",
    ".design-harness/runs/20260922-seo-10-20260922/evidence/screenshots/tv-usb-recording-desktop-success.png": "sha256:50df3525de16a0a04b9f141193fa67e6bd368abb32aeb49ff10fb13c62c5d5f5",
    ".design-harness/runs/20260922-seo-10-20260922/evidence/screenshots/tv-usb-recording-mobile-success.png": "sha256:d70b539c6aa4c5a108283ac9edeb6d7fca51ed559089f8168d6cfe3ca75750a1",
    ".design-harness/runs/20260922-seo-10-20260922/evidence/screenshots/tv-usb-recording-tablet-success.png": "sha256:72c57f6b477f0fe274c60d85eb0df319cc69f749ec94c3c752863d0941f03d95",
    ".design-harness/runs/20260922-seo-10-20260922/evidence/screenshots/usb-video-codec-desktop-success.png": "sha256:bce2aa502d7244f5acc3a9bd300dcfbd1676d13d7130e41588d74333e70be0cc",
    ".design-harness/runs/20260922-seo-10-20260922/evidence/screenshots/usb-video-codec-mobile-default.png": "sha256:ad510bc8aa67a695abc4f95b69982bf1a7703d6e0d59c9ee0d3fd09bdcdbdf41",
    ".design-harness/runs/20260922-seo-10-20260922/evidence/screenshots/usb-video-codec-mobile-disabled.png": "sha256:bef6d20e62cfbb2ffca21b398b865f912f09ffcf49b9cb0fe2211733fc0fe23d",
    ".design-harness/runs/20260922-seo-10-20260922/evidence/screenshots/usb-video-codec-mobile-empty.png": "sha256:ad510bc8aa67a695abc4f95b69982bf1a7703d6e0d59c9ee0d3fd09bdcdbdf41",
    ".design-harness/runs/20260922-seo-10-20260922/evidence/screenshots/usb-video-codec-mobile-error.png": "sha256:4a1d68b89305102459e5b8aecc28184cf6c60ab0cd056534fbba885c7e28cdc3",
    ".design-harness/runs/20260922-seo-10-20260922/evidence/screenshots/usb-video-codec-mobile-focus.png": "sha256:e122a20bb9f55e768cd704649014ce84a2112f333a1d1479d4482040b9faf2c8",
    ".design-harness/runs/20260922-seo-10-20260922/evidence/screenshots/usb-video-codec-mobile-loading.png": "sha256:4e49cd2629b50d5798cc7cd604b292532a01403ecaaede026e5038881f89d471",
    ".design-harness/runs/20260922-seo-10-20260922/evidence/screenshots/usb-video-codec-mobile-needs-review.png": "sha256:5b2c08a5f4acc0aaf2bbe6164da605e31211e4daa2e8259ae1819ebbf072ce1d",
    ".design-harness/runs/20260922-seo-10-20260922/evidence/screenshots/usb-video-codec-mobile-success.png": "sha256:2d69f8d99e12c4e05105243fccbda8478f9e2488f03efaedb662c1e490dff9ff",
    ".design-harness/runs/20260922-seo-10-20260922/evidence/screenshots/usb-video-codec-tablet-success.png": "sha256:14f31b880c19c67fd719eb702fd43fbe84d1bbec1f8ae3ab6369bb88dedc4204",
    ".design-harness/runs/20260922-seo-10-20260922/evidence.json": "sha256:d56edbc66f508fff7a395837a96059232747c67d85eb916b3aa68a934b35f3b6",
    ".design-harness/runs/20260922-seo-10-20260922/review.md": "sha256:b3455ba9b4853166385b7e5000a02ceaf9db8e60b3eb76fac373097ee9ca288b",
    ".design-harness/runs/20260922-seo-10-20260922/task.json": "sha256:e82300949fed1a41b9cded3e828faa21c9f0f64d7379ee4d6fdd09059e0a908c",
    ".design-harness/runs/20260922-seo-10-20260922/visual-direction.md": "sha256:5ac24a069d195b6d3ab7a3997644201a0ce120d6424708de379f4703705f9f8e"
  },
  "packet_hash": "sha256:f5228d4677f455fd451c240eca4883ad10c5fd9051035a7a7a88f0ba857d9f1f"
}
